Course_Code,Course_Title,L-T-P-S-C,Faculty,Semester_Half,Elective,Students,basket
MA161,Statistics,3-0-0-0-2,Dr. Ramesh Athe,1,0,214,0
DS161,Introduction to DS and AI,3-0-0-0-2,Dr. Abdul Wahid,1,0,214,0
MA162,Probability,3-0-0-0-2,Dr. Chinmayananda,2,0,214,0
EC161,Digital Design,3-0-2-0-2,Dr. Prakash Pawar,2,0,214,0
CS161,Problem Solving through Programming,3-0-2-0-4,Dr. Sunil Kumar PV,0,0,214,0
HS161,English Language and Communication,3-0-0-0-3,Dr. Rajesh N S,0,0,214,0
NEW,Fundamentals of Sensing and Control,3-0-0-0-2,Mr. Mallikarjun Kande,2,1,32,1
NEW,Leveraging IT for Social Good & CSR,3-0-0-0-2,Dr. Rajesh N S,2,1,12,1
NEW,Basics of Design,3-0-0-0-2,Dr. Sandesh P,2,1,32,1
HS156,Holistic Personality Development,3-0-0-0-1,Dr. Rajesh N S,2,1,12,1
CS151,Introduction to Cybersecurity,3-0-0-0-2,Dr. Girish Revadigar,2,1,74,1
PH151,Introduction to Quantum Physics,3-0-0-0-2,Prof. Ravishankar,1,1,19,1
DS151,Linux for Engineers,3-0-0-0-2,Dr. Vivekraj V K,1,1,34,1